Sr. No.,Date(dd/mm/yyyy),Startup Name,Industry/ Vertical,Sub-Vertical,City / Location,Investors’ Name,Invest-mentType,Amount (in USD)
1,01/6/2016,Chikoop,Consumer Internet,Free Ad based Voice Calling,Indore,Undisclosed Investors,Seed Funding,N/A
2,01/6/2016,BRIDGEi2I,Technology,Data Analytics Platform,Bangalore,Edelweiss Private Equity,Private Equity,N/A
3,02/6/2016,Droom,eCommerce,Online marketplace for used automobiles,New Delhi,"Beenext, Digital Garage, Lightbox, Beenos",Private Equity,N/A
4,02/6/2016,Visit,Consumer Internet,On-Demand Healthcare Service provider,New Delhi,MapmyIndia,Seed Funding,N/A
5,02/6/2016,Atomberg,Technology,"smart, energy efficient home appliance manufacturer",Mumbai,Parampara Capital,Private Equity,"1,000,000"
6,02/6/2016,Coutloot,eCommerce,Fashion Re-Commerce Platform,Mumbai,Venture Catalysts,Seed Funding,N/A
7,02/6/2016,Limo,Consumer Internet,Bus Aggregator Mobile app,Mumbai,Rainmaker Ventures,Private Equity,"1,000,000"
8,03/6/2016,iCliniq,Consumer Internet,Doctor Consultation platform,Bangalore,MadhanKumar Madathupalayam,Seed Funding,N/A
9,03/6/2016,GoGo Truck,Consumer Internet,Truck Aggregator & Booking platform,Chennai,Undisclosed Investor,Seed Funding,"75,000"
10,03/6/2016,Vyome Biosciences,Healthcare,Treatment Development for Antibiotic-resistant diseases,New Delhi,Romulus Capital,Private Equity,"2,000,000"
11,06/6/2016,SillyMonks,Consumer Internet,Digital Media and Entertainment Startup,Hyderabad,Sreenivasa Reddy Musani,Seed Funding,"448,000"
12,07/06/2016,CueMath,Education,K-12 Maths Learning Courses,Bangalore,"Sequoia Capital, Unitus Seed Fund",Private Equity,"4,000,000"
13,07/06/2016,KrazyBee,Consumer Internet,Student Micro-Loan platform,Bangalore,"Yeahmobi, Fenqile",Private Equity,"2,000,000"
14,07/06/2016,Intgrea,Technology,Post merger Integration Partners,Bangalore,Undisclosed Investor,Seed Funding,"100,000"
15,07/06/2016,HelpShift,Technology,Mobile CRM Platform,Pune,"Microsoft Ventures, Salesforce Ventures",Private Equity,"23,000,000"
16,07/06/2016,CreditVidya,Technology,Credit Scoring Platform,Mumbai,Kalaari Capital,Private Equity,"1,000,000"
17,08/06/2016,Grey Campus,Consumer Internet,Online Learning Platform,Hyderabad,Sarath Sura,Seed Funding,"1,000,000"
18,08/06/2016,ListUp,eCommerce,Location based Classified Mobile app,Mumbai,"Kae Capital, Kunal Shah, Sandeep Tandon",Seed Funding,"500,000"
19,08/06/2016,6Degree,Technology,Tech-enabled Fashion Talent platform,Mumbai,Indian Angel Network,Seed Funding,"200,000"
20,08/06/2016,Shopwati,Consumer Internet,Online Fashion Discussion Community,Gurgaon,Sanjiv Rai,Seed Funding,N/A
21,08/06/2016,Cookifi,Consumer Internet,Online Chef Discovery & Booking Service,Bangalore,"Kunal Shah, Aneesh Reddy, Tracxn Labs, Venkat Tadanki, Krishna Mehra, Amit Rathore",Seed Funding,N/A
22,08/06/2016,StoreKing,eCommerce,Connecting Small Town Consumers to E-Commerce,Bangalore,Axiata Digital,Private Equity,"16,000,000"
23,08/06/2016,Wired Hub,Real Estate,Co-Working Spaces,Jaipur,"Ankit Maheshwari, Anand Singh",Seed Funding,N/A
24,08/06/2016,MySeniorDoctor,Consumer Internet,Online medical support platform,Gurgaon,BlackJag Partners,Seed Funding,"200,000"
25,09/06/2016,Teabox,eCommerce,Online Tea Store,Siliguri,Cameron Jones,Seed Funding,N/A
26,09/06/2016,ExtraaEdge,Consumer Internet,Student Acquisition Platform,Pune,"Ritesh Dwivedy, Priti Padhy",Seed Funding,N/A
27,09/06/2016,EPayLater,Technology,Fin-Tech Platform,Mumbai,3 undisclosed HNIs,Seed Funding,"2,000,000"
28,10/06/2016,Kyazoonga,eCommerce,Online event ticketing Platform,Mumbai,Ratan Tata,Seed Funding,N/A
29,10/06/2016,Paytunes,Consumer Internet,Mobile based rewards platform,New Delhi,"CIO Angel Network, Indian Angel Network",Private Equity,"500,000"
30,10/06/2016,Kickstart Jobs,Technology,Entry level hiring platform,Gurgaon,"Vivek Joshi, Mohit Satyanand, Amit Banati, Arun Khanna",Seed Funding,N/A
31,10/06/2016,Freshee,FMCG,Household packaging & Storage product manufacturer,Mumbai,Edelweiss Private Equity,Private Equity,N/A
32,10/06/2016,MadRat Games,Technology,Wearable Gaming Platform,Bangalore,"Ratan Tata, Bhavish Aggarwal, Ankit Bhati, Binny Bansal, Girish Mathrubootham",Seed Funding,N/A
33,11/06/2016,Jazzmyride,eCommerce,Auto Parts & Accessories eTailer,New Delhi,TVS Automobile Solutions Ltd,Private Equity,N/A
34,11/06/2016,AutoSense,Technology,Data Analytics based Customer Management Services,New Delhi,TVS Automobile Solutions Ltd,Private Equity,N/A
35,11/06/2016,Redsun Telematics,Consumer Internet,Internet of Things Platform,Chennai,TVS Automobile Solutions Ltd,Private Equity,N/A
36,13/06/2016,KhanaGadi,Consumer Internet,Online Food Delivery for Train Travelers,Jaipur,50K Ventures,Seed Funding,N/A
37,13/06/2016,Bombay Shirt Company,eCommerce,Online custom Shirt retailer,Mumbai,undisclosed investor,Private Equity,"1,000,000"
38,13/06/2016,Matrubharti,Consumer Internet,e-Book Publisher,,Viridian Capital,Seed Funding,"30,000"
39,14/06/2016,EdTechReview,Consumer Internet,Education based online portal,New Delhi,EVC Ventures,Seed Funding,N/A
40,14/06/2016,Bonhomia,Food & Beverage,Premium Tea & Coffee Capsules maker,New Delhi,Valpro Capital and existing investors,Private Equity,N/A
41,14/06/2016,Gobolt,Logistics,B2B Logistics provider,New Delhi,MCube8,Seed Funding,N/A
42,14/06/2016,Jivox,Technology,Data Driven Advertising platform,Bangalore,"You & Mr Jones, Fortisure Ventures, Diaz Nesamoney",Private Equity,"6,000,000"
43,14/06/2016,Sminq,Consumer Internet,Queue management Mobile app,Pune,"Saama Capital, Blume Ventures & Vaibhav Domkundwar",Seed Funding,"1,000,000"
44,14/06/2016,CureJoy,Consumer Internet,Online Alternative health community platform,Bangalore,Accel Partners India,Private Equity,"4,400,000"
45,15/06/2016,Oneway.cab,Consumer Internet,Taxi Rental Platform,Vadodara,Indian Angel Network,Seed Funding,"450,000"
46,15/06/2016,GrabOnRent,eCommerce,On-demand product rental marketplace,Bangalore,IvyCap Ventures and Unicorn India Ventures,Private Equity,N/A
47,16/06/2016,Diro Labs,Consumer Internet,Contact Management Mobile App,New Delhi,Info Edge (India) Ltd,Private Equity,"450,000"
48,16/06/2016,Unnati Helpers,Consumer Internet,Help Hiring Platform,Gurgaon,Info Edge (India) Ltd,Private Equity,"600,000"
49,16/06/2016,Athletto,Consumer Internet,Sports Venue discovery and booking platform,Bangalore,Atul Ingle,Seed Funding,N/A
50,16/06/2016,Saavn,Consumer Internet,Web/Mobile Music Streaming service,USA,Guy Oseary,Private Equity,N/A
51,16/06/2016,Voonik,eCommerce,Online Women’s Fashion Marketplace,Bangalore,Sequoia Capital,Private Equity,"20,000,000"
52,16/06/2016,ThinkPhi,Technology,Sustainable Green Tech Solution developer,Mumbai,Nimmagadda Prasad,Seed Funding,N/A
53,17/06/2016,Cleartax,Consumer Internet,Online Tax Filing Platform,New Delhi,"Ravi Adusumalli, SAIF Partners",Private Equity,"12,000,000"
54,17/06/2016,Silvan Innovation Labs,Technology,Home Automation Solutions,Bangalore,Infuse Ventures,Private Equity,"900,000"
55,17/06/2016,GreytHR,Technology,Payroll & HR Software Developer,Bangalore,"New Enterprise Associates (NEA), Blume Ventures",Private Equity,"5,200,000"
56,17/06/2016,Duffl,eCommerce,Fashion Rental Marketplace,Bangalore,BetOnIndia Technology Pvt Ltd,Seed Funding,N/A
57,17/06/2016,BYG,Consumer Internet,Fitness centre Discovery & Booking Mobile app,Bangalore,"Sanjay Verma, Amit Khanna (LetsVenture)",Seed Funding,N/A
58,20/06/2016,Dipper,eCommerce,Freight Logistics Marketplace,New Delhi,Undisclosed investor,Seed Funding,N/A
59,20/06/2016,Qonfuse,Consumer Internet,Online Test Papers for competitive exams,New Delhi,Hamraj Kumar,Seed Funding,N/A
60,20/06/2016,The Indian IRIS,Consumer Internet,Govt Policy Research & Information portal,Ahmedabad,Timbru Ventures,Seed Funding,N/A
61,21/06/2016,Onspoon,Consumer Internet,Online Platform for Event Sponsorship,Mumbai,Swan Angel Network,Seed Funding,"150,000"
62,21/06/2016,REstate,Consumer Internet,Real Estate Platform,Bangalore,Idein Ventures,Seed Funding,N/A
63,21/06/2016,Cleartrip,Consumer Internet,Online Travel Agency,Mumbai,"Concur Technologies, Gund Investment",Private Equity,N/A
64,21/06/2016,ProcMart,Consumer Internet,Online Procurement Marketplace,Noida,IndiaMart,Private Equity,N/A
65,21/06/2016,Celerix,Technology,Fintech Product Development & Services Startup,Bangalore,Bitkemy Ventures,Seed Funding,"400,000"
66,21/06/2016,NatureNama,Consumer Internet,Online Outdoors & travel,Mumbai,Unicorn Venture,Seed Funding,"225,000"
67,21/06/2016,CyclopsMedtech,Technology,Medical Technology Provider,Bangalore,CP Bothra,Seed Funding,N/A
68,21/06/2016,Syona Cosmetics,FMCG,Beauty Products & Training to Salons & Spas,Chennai,The Chennai Angels,Seed Funding,"150,000"
69,21/06/2016,PrettySecrets,eCommerce,Women Lingerie Store,Mumbai,"RB Investments PTE Ltd, Orios Venture Partners",Private Equity,"6,000,000"
70,22/06/2016,SpiderG,Consumer Internet,Online invoice app for SMEs,Pune,"Rahul Kirloskar, Fusion Tech Ventures, Adi Saravanan, Pravin Dongre, Mahendra Doshi",Seed Funding,"150,000"
71,23/06/2016,FarEye,Technology,Logistics Management Software,New Delhi,Saif Partners,Private Equity,"3,500,000"
72,23/06/2016,The Uolo,Consumer Internet,School Parent Communication App,Bangalore,"Purvi Ventures, Rajul Garg, Vipin Arora",Seed Funding,"210,000"
73,23/06/2016,Staqu,Technology,Artificial Intelligence based search platform,Gurgaon,Indian Angel Network,Seed Funding,N/A
74,23/06/2016,Padhopadhao,Consumer Internet,Home Tutors search & Discovery,New Delhi,Rise India,Private Equity,N/A
75,24/06/2016,Drivify,Consumer Internet,Professional Driver discovery & Booking Mobile app,Mumbai,"Jitendra Gupta, Pankaj Tripathi",Seed Funding,"50,000"
76,24/06/2016,PratiLipi,Consumer Internet,Multi-Lingual self-publishing platform,Bangalore,Nexus Venture Partners,Seed Funding,N/A
77,24/06/2016,ParaBlu,Technology,Cloud Data Security & Privacy Solutions,Bangalore,Kalaari Capital,Seed Funding,"500,000"
78,24/06/2016,Schedulers Logistics,Logistics,Cold Storage Logistics solutions,Mumbai,GVFL,Private Equity,"6,000,000"
79,24/06/2016,LEAP India,Others,Supply Chain Equipment & Services provider,Mumbai,Mayfield Ventures,Private Equity,"3,000,000"
80,24/06/2016,KabadiExpress,Others,Free Door Step Scrap Pickup Service,New Delhi,Undisclosed investor,Seed Funding,"148,000"
81,27/06/2016,YourDost,Consumer Internet,Online counselling & Personal coaching platform,Bangalore,"SAIF Partners, Aprameya Radhakrishnan, Phanindra Sama, Subba Rao Telidevara, Vibhu Garg, Paula Ravindra Mariwala, Gaurav Bhalotia",Seed Funding,"1,200,000"
82,27/06/2016,Gomalon,Consumer Internet,Online Spa & Salon discovery & Booking platform,Bangalore,Undisclosed investor,Seed Funding,"100,000"
83,27/06/2016,Voler Cars,Consumer Internet,Self-Driven Car rental platform,New Delhi,"Kanodia family, Amit Banka",Seed Funding,N/A
84,27/06/2016,Travelyaari,Consumer Internet,Online ticket booking platform,Bangalore,GVFL Ltd,Private Equity,"3,000,000"
85,28/06/2016,FabHotels,Consumer Internet,Online Hotel aggregator & Booking platform,Gurgaon,"Accel Partners, RB Investments",Private Equity,"8,000,000"
86,28/06/2016,Locanix,Technology,GPS based SaaS Solutions,Ahmedabad,Undisclosed investors,Seed Funding,"300,000"
87,28/06/2016,LendingKart,Consumer Internet,Online Working Capital Business Loans Platform,Ahmedabad,"Bertelsmann India Investments, Mayfield India, Saama Capital, India Quotient",Private Equity,"32,000,000"
88,28/06/2016,Hello Tax,Consumer Internet,Online Tax Filing Platform,New Delhi,Sanjeev Sinha,Seed Funding,"295,000"
89,28/06/2016,MySuperBrain,Consumer Internet,Online Talent Discovery Platform for Kids,Hyderabad,Soniks Consulting,Seed Funding,N/A
90,28/06/2016,BlogBeats,Consumer Internet,Online Blogging Platform,Bangalore,Undisclosed Investor,Seed Funding,N/A
92,29/06/2016,LetReach,eCommerce,ECommerce SAAS Solutions,New Delhi,vCommission,Private Equity,"100,000"
93,29/06/2016,TrendieApp,Technology,Visual Content Marketing,Kolkata,Harsh Vardhan Hada,Seed Funding,"50,000"
94,29/06/2016,ImpactGuru,Consumer Internet,Crowdfunding Platform,Mumbai,Piyush Jain,Seed Funding,N/A
95,29/06/2016,Velvetcase,eCommerce,Online designer jewellery marketplace,Mumbai,"Uniqorn Ventures Fund, TV Mohandas Pai, S Somasegar",Private Equity,"1,500,000"
96,30/06/2016,Meru Cabs,Consumer Internet,Online/ Mobile Tax Cab booking,Mumbai,Brand Capital,Private Equity,"25,000,000"
97,30/06/2016,Campus Diaries,Consumer Internet,Student focussed Content Discovery portal,Bangalore,Aarin Capital,Seed Funding,"220,000"
98,30/06/2016,Scripbox,Consumer Internet,Online Mutual Fund Investment platform,Bangalore,"Omidyar Network, Accel Partners & existing investors",Private Equity,N/A
99,30/06/2016,Biryani Blues,Food & Beverage,QSR Chain,Gurgaon,Carpediem Capital & Others,Private Equity,"368,000"
100,30/06/2016,,,,,,,
,,,,,,,,
